{
 "schema": 2,
 "writer": "page",
 "at": "2026-10-16T01:00:00Z",
 "source": "E.V. Home",
 "kind": "skill",
 "status": "ended",
 "date": "2026-10-15",
 "startedAt": "2026-10-16T01:00:00Z",
 "topic": "Made-up checklist",
 "skill": {
  "materialId": null,
  "page": null,
  "cite": "",
  "steps": [
   {
    "n": 1,
    "text": "A made-up step"
   }
  ],
  "rule": {}
 },
 "events": {
  "page-20261016-010000000": {
   "type": "start",
   "at": "2026-10-16T01:00:00Z"
  }
 }
}
