{
 "schema": 2,
 "writer": "filing",
 "at": "2026-10-15T02:00:00Z",
 "source": "E.V. Home",
 "date": "2026-10-14",
 "startedAt": "2026-10-15T00:00:00Z",
 "endedAt": "2026-10-15T00:40:00Z",
 "topic": "Made-up filed note",
 "minutes": 40,
 "checks": 2,
 "questions": 4,
 "endedBy": "user",
 "summary": "A made-up summary.",
 "weakSpots": [],
 "cardCount": 0,
 "filedAt": "2026-10-15T02:00:00Z"
}
